جمال الدين أبو الفرج عبد الرحمن بن علي بن محمد الجوزي (المتوفى: 597هـ)	جمال الدين أبي الفرج عبد الرحمن ابن الجوزي	y
أبو البركات	أبو البركات عبد الله بن أحمد بن محمود حافظ الدين النسفي (المتوفى: 710هـ)	n
أبو بكر بن أبي داود، عبد الله بن سليمان بن الأشعث الأزدي السجستاني (المتوفى: 316هـ)	سليمان بن الأشعث أبو داود	m
أحمد بن علي المقريزي	تقي الدين أحمد بن علي المقريزي	y
أبو القاسم سليمان بن أحمد الطبراني	سليمان بن أحمد بن أيوب بن مطير اللخمي الشامي، أبو القاسم الطبراني (المتوفى: 360هـ)	y
أبو الوليد إسماعيل بن يوسف بن الأحمر (المتوفى : 807هـ)	إسماعيل بن يوسف بن محمد بن نصر الخزرجي الأنصاري النصري، أبو الوليد، المعروف بابن الأحمر (المتوفى: 807هـ)	y
أبو العباس أحمد بن أبي أحمد الطبري المعروف بـ ابن القاص (المتوفى: 335هـ)	أبو العباس أحمد بن أحمد الطبري	y
أبو المنجى عبد الله بن عمر بن علي بن زيد، ابن اللتي البغدادي، الحريمي، الطاهري، القزاز (المتوفى: 635هـ)	زيد بن علي	n
أبو إسحاق إسماعيل بن جعفر بن أبي كثير الأنصاري الزرقي المدني (المتوفى : 180هـ)	إسماعيل بن جعفر بن أبي كثير الأنصاري الزرقي مولاهم، أبو إسحاق المدني - ويكني أيضا: أبا إبراهيم (المتوفى: 180هـ)	y
أبو الفرج عبد الرحمن بن علي بن محمد بن علي بن عبيد الله بن عبد الله بن هادي بن أحمد بن محمد بن جعفر الجوزي	عبد الرحمن بن علي بن الجوزي	y
أبو الفرج عبد الرحمن بن علي بن محمد القرشي	جمال الدين أبو الفرج عبد الرحمن بن علي بن محمد الجوزي (المتوفى: 597هـ) (منسوب خطأ في المطبوع لابن قيم الجوزية)	y
أبو الحارث سريج بن يونس بن إبراهيم البغدادي (المتوفى : 235هـ)	أبو الحارث سريج بن يونس بن إبراهيم البغدادي (المتوفى: 235هـ)	y
أبو المجد اسعد بن إبراهيم الشيباني الإربلي المعروف بمجد الدين النشابي الكاتب (المتوفى : 657هـ)	أبو المجد اسعد بن إبراهيم الشيباني الإربلي المعروف بمجد الدين النشابي الكاتب (المتوفى: 657هـ)	y
محمد بن الحسين أبو الفتح الأزدي الموصلي	محمد بن الحسين الأزدي أبو الفتح	y
أبو بكر أحمد بن مروان الدينوري المالكي (المتوفى: 333هـ)	الدينوري	n
أبو بكر بن أبي عاصم وهو أحمد بن عمرو بن الضحاك بن مخلد الشيباني (المتوفى: 287هـ)	أحمد بن عمرو بن أبي عاصم الشيباني	y
أبو الفضل عبد الرحمن جلال الدين السيوطي	جلال الدين أبي الفضل عبد الرحمن السيوطي	y
أبو الحسن ظهير الدين علي بن زيد بن محمد بن الحسين البيهقي، الشهير بابن فندمه (المتوفى: 565هـ)	زيد بن علي	n
أبو القاسم البغوي	عبد الله بن محمد بن عبد العزيز البغوي أبو القاسم	y
أبا علي إسماعيل بن القاسم القالي البغدادي	البغدادي	n
عبد الرحمن بن أحمد بن رجب الحنبلي (المتوفى : 795هـ)	عبد الرحمن بن أحمد بن رجب الحنبلي (المتوفى: 795هـ)	y
أبو أحمد بن عدي الجرجاني (المتوفى: 365هـ)	عبد الله بن عدي الجرجاني أبو أحمد	y
أبو بشر محمد بن أحمد بن حماد بن سعيد بن مسلم الأنصاري الدولابي الرازي (المتوفى: 310هـ)	الإمام الحافظ أبو بشر محمد بن أحمد بن حماد الدولابي	y
أبو العباس، عبد الله بن محمد المعتز بالله ابن المتوكل ابن المعتصم ابن الرشيد العباسي (المتوفى: 296هـ)	عبد الله بن محمد ابن المعتز العباسي (المتوفى : 296هـ)	y
أبو الحسن علي بن محمد بن محمد بن حبيب البصري البغدادي، الشهير بالماوردي (المتوفى: 450هـ)	محمد بن حبيب البغدادي	n
أحمد بن علي بن عبد القادر، أبو العباس الحسيني العبيدي، تقي الدين المقريزي (المتوفى: 845هـ)	تقي الدين أبي العباس أحمد بن علي بن عبد القادر العبيدي المقريزي	y
أبو الفضل عبد الرحمن بن أحمد بن الحسن بن بندار العجلي الرازي المقرئ	المقرئ	m
أبو العباس أحمد بن محمد بن علي ابن حجر الهيثمي	ابن حجر الهيثمي	y
أبو اسحاق إبراهيم بن علي المعروف بالحصري القيرواني (المتوفى : 453هـ)	القيرواني	n
أبو الفتح، سليم بن أيوب بن سليم الرازي (المتوفى: 447هـ)	الرازي	n
أبو الحسن علي بن محمد الماوردي الشافعي	أبو الحسن علي بن محمد بن حبيب الماوردي البصري	y
أبو إسماعيل عبد الله بن محمد الأنصاري الهروي (المتوفى: 481هـ)	محمد بن عبد الله الأنصاري	n
أبو بكر بن أبي داود، عبد الله بن سليمان بن الأشعث الأزدي السجستاني (المتوفى: 316هـ)	أبو بكر عبد الله بن سليمان بن الأشعث السجستاني	y
أبو بكر أحمد بن الحسين بن علي بن موسى البيهقي	البيهقي	y
أبو القاسم سليمان بن أحمد الطبراني	سليمان بن أحمد بن أيوب الطبراني أبو القاسم	y
أبو الفرج عبد الرحمن بن الجوزي	ابن الجوزي	y
أبو القاسم محمود بن عمر الزمخشري	الزمخشري	y
أبو الحسين يحيى بن أبي الخير بن سالم العمراني اليمني الشافعي (المتوفى: 558هـ)	يحيى بن أبي الخير العمراني	y
أبو بكر أحمد بن علي بن ثابت الخطيب البغدادي	البغدادي	n
أحمد بن محمد بن علي بن حجر الهيتمي أبو العباس	ابن حجر الهيتمي	y
أبو العباس أحمد بن عبد الواحد بن أحمد المقدسي، الحنبلي، الملقب بالبخاري (المتوفى: 623هـ)	الشمس، أبو العباس أحمد بن عبد الواحد بن أحمد المقدسي، الحنبلي، الملقب بالبخاري (المتوفى: 623هـ)	y
أبو الحسن سيد الدين علي بن أبي علي بن محمد بن سالم الثعلبي الآمدي (المتوفى: 631هـ)	علي بن أبي علي بن محمد بن سالم الآمدي	y
أ. د / عبد الله بن محمد بن أحمد الطيار	أحمد محمد عبد الله	n
أبو القاسم عمر بن الحسين الخرقي	أبو القاسم عمر بن الحسين بن عبد الله الخرقي (المتوفى: 334هـ)	y
أبو البقاء عبد الله بن الحسين العكبري	الشيخ الامام محب الدين أبي البقاء عبد الله بن الحسين العكبري الحنبلي	y
عبد الرحمن بن علي بن محمد أبو الفرج	عبد الرحمن بن علي بن محمد الجوزي	y
أبو الحسن علي بن عبد العزير القاضي الجرجاني (المتوفى : 392هـ)	أبو الحسن علي بن عبد العزير القاضي الجرجاني (المتوفى: 392هـ)	y
أبو الحسن سيد الدين علي بن أبي علي بن محمد بن سالم الثعلبي الآمدي (المتوفى: 631هـ)	الآمدي	y
أبو بشر محمد بن أحمد بن حماد الدولابي	محمد بن أحمد الدولابي	y
علي بن أبي بكر الهيثمي أبو الحسن	نور الدين علي بن أبي بكر بن سليمان الهيثمي (المتوفى: 807هـ)	y
أبو البقاء عبد الله بن الحسين بن عبد الله العكبري البغدادي محب الدين (المتوفى: 616هـ)	الشيخ الامام محب الدين أبي البقاء عبد الله بن الحسين العكبري الحنبلي	y
أبو بكر أحمد بن محمد ابن الحافظ الكبير أبي بكر أحمد بن موسى بن مردويه بن فورك بن موسى الأصبهاني (المتوفى: 498هـ)	الأصبهاني	n
أبو القاسم سليمان بن أحمد الطبراني	سليمان بن أحمد بن أيوب أبو القاسم الطبراني	y
أبو القاسم هبة الله بن الحسن بن منصور الطبري الرازي اللالكائي (المتوفى: 418هـ)	الطبري	n
أحمد بن حجر العسقلاني	أحمد بن علي بن حجر أبو الفضل العسقلاني	y
أحمد بن علي المقريزي	المقريزي	y
أبو الفرج عبد الرحمن بن أبي الحسن الجوزي	عبد الرحمن بن علي بن محمد أبو الفرج	y
أبو أمية محمد بن إبراهيم بن مسلم الخزاعي البغدادي ثم الطرسوسي (المتوفى: 273هـ)	محمد بن إبراهيم الطرسوسي أبو أمية	y
أبو القاسم البغوي	أبو القاسم عبد الله بن محمد بن عبد العزيز البغوي	y
أبو أحمد الحسن بن عبد الله بن سعيد بن إسماعيل العسكري (المتوفى: 382هـ)	الحسن بن عبد الله بن سعيد العسكري أبو أحمد	y
ابن الجوزي	عبد الرحمن بن علي بن محمد أبو الفرج	y
أبو بكر عبد الرزاق بن همام الصنعاني	عبد الرزاق بن همام الصنعاني	y
أبو بكر النجاد، أحمد بن سلمان بن الحسن بن إسرائيل بن يونس البغدادي (المتوفى: 348هـ)	أحمد بن سلمان النجاد أبو بكر	y
أبو الحسين أحمد بن فارس بن زكريا (المتوفى : 395هـ)	أبو الحسين أحمد بن فارس زكريا	y
أبو بكر أحمد بن الحسين بن علي بن عبد الله البيهقي	أحمد بن الحسين بن علي بن موسى الخسروجردي الخراساني، أبو بكر البيهقي (المتوفى : 458هـ)	y
الباقلاني	محمد بن الطيب الباقلاني	y
أبو الفضل محمد بن طاهر بن علي بن أحمد المقدسي الشيباني، المعروف بابن القيسراني (المتوفى: 507هـ)	محمد بن طاهر بن علي المقدسي أبو الفضل	y
أبو الحسن ظهير الدين علي بن زيد البيهقي، الشهير بابن فندمه (المتوفى: 565هـ)	زيد بن علي	n
أبو الفرج عبد الرحمن ابن الجوزي	عبد الرحمن بن علي بن محمد الجوزي	y
أبو بكر أحمد بن علي بن ثابت الخطيب البغدادي	أحمد بن علي بن ثابت البغدادي أبو بكر	y
أبو إسحاق الحويني الأثري حجازي محمد شريف	أبو إسحاق الحويني الأثري حجازي محمد شريف (بحث نهي الصحبة فقط)	y
سليمان بن أحمد بن أيوب الطبراني أبو القاسم	سليمان بن أحمد بن أيوب بن مطير اللخمي الشامي، أبو القاسم الطبراني (المتوفى : 360هـ)	y
أبو بكر أحمد بن الحسين بن علي بن عبد الله البيهقي	أحمد بن الحسين البيهقي	y
أبو القاسم محمود بن عمر الزمخشري	أبو القاسم محمود بن عمر الزمخشري الخوارزمي	y
أبو الحسن علي بن أبي الكرم محمد بن محمد بن عبد الكريم الشيباني	محمد بن الحسن الشيباني	n
أبو البقاء عبد الله بن الحسين العكبري	أبو البقاء عبد الله بن الحسين بن عبد الله العكبري	y
أبو إسماعيل عبد الله بن محمد بن علي الأنصاري الهروي (المتوفى: 481هـ)	عبد الله بن محمد بن علي بن محمد الهروي أبو إسماعيل	y
أبو بكر بن الحسين بن عمر، القرشي العبشمي الأموي العثماني، زين الدين، وكنيته أبو محمد ويقال اسمه (عبد الله) والمشهور (أبو بكر) المصري الشافعي المراغي (المتوفى: 816هـ)	القرشي المصري	n
أبو العباس أحمد بن خالد بن محمد الناصري	خالد محمد خالد	n
أبو العباس شمس الدين أحمد بن محمد بن أبي بكر بن خلكان	أبو العباس شمس الدين أحمد بن محمد بن إبراهيم بن أبي بكر ابن خلكان البرمكي الإربلي (المتوفى: 681هـ)	y
محمد بن طاهر المقدسي	محمد بن طاهر بن علي بن القيسراني	y
أبو الحسن علي بن حبيب الماوردي	أبو الحسن علي بن محمد الماوردي الشافعي	y
أبو أحمد الحسن بن عبد الله بن سعيد بن إسماعيل العسكري (المتوفى: 382هـ)	العسكري	y
أبو بكر أحمد بن مروان بن محمد الدينوري القاضي المالكي	الدينوري	n
أبو منصور عبد الملك عبد الملك بن محمد بن إسماعيل الثعالبي	عبد الملك بن محمد بن إسماعيل أبو منصور الثعالبي (المتوفى : 429هـ)	y
أحمد بن علي العسقلاني أبو الفضل	أحمد بن علي بن حجر	y
أبو الفضل محمد بن عبد الوهاب بن عبد اللطيف الأعرج (المتوفى: 925هـ)	عبد الوهاب	n
أبو بكر أحمد بن الحسين بن علي بن عبد الله البيهقي	أحمد بن الحسين بن علي البيهقي أبو بكر	y
أبو الحسن القاضي أحمد بن سليمان بن أيوب بن داود بن عبد الله بن حذلم الأسدي الدمشقي الأوزاعي (المتوفى: 347هـ)	الحسن بن أحمد بن عبد الله أبو علي	n
عبد الرحيم العراقي	عبد الرحيم بن الحسين العراقي أبو الفضل	y
أبو منصور عبد الملك بن محمد بن إسماعيل الثعالبي	الثعالبي	y
أبو بكر القاسم بن زكريا بن يحيى البغدادي، المعروف: بالمطرز (المتوفى: 305هـ)	البغدادي	n
الضحاك	عمرو بن أبي عاصم	y
أبو الحسن ظهير الدين علي بن زيد البيهقي ، الشهير بابن فندمه (المتوفى : 565هـ)	زيد بن علي	n
أبو العباس أحمد بن أبي أحمد الطبري المعروف بـ ابن القاص (المتوفى: 335هـ)	الطبري	n
سليمان بن خلف الباجي	سليمان بن خلف بن سعد أبو الوليد الباجي	y
أبو المعالي عبد الملك بن عبد الله بن يوسف الجويني	عبد الملك بن عبد الله بن يوسف الجويني أبو المعالي	y
أبو القاسم علي بن الحسن بن هبة الله المعروف بابن عساكر (المتوفى: 571هـ)	علي بن الحسن بن هبة الله أبو القاسم	y
أبو إسحاق إبراهيم بن إسحاق بن إبراهيم بن بشير البغدادي الحربي (المتوفى: 285هـ)	إبراهيم بن إسحاق الحربي أبو إسحاق	y
أحمد بن علي بن ثابت البغدادي	الخطيب البغدادي	y
أبي الفرج عبد الرحمن بن الجوزي	جمال الدين أبو الفرج عبد الرحمن بن علي بن محمد الجوزي (المتوفى: 597هـ)	y
أبو الحسن علي بن محمد الماوردي	أبو الحسن علي بن محمد بن حبيب البصري البغدادي الماوردي	y
أبو إسحاق إبراهيم بن علي الشيرازي	أبي إسحاق إبراهيم بن علي الشيرازي	y
أبو القاسم الحسن بن بشر الآمدي (المتوفى: 370هـ)	الآمدي	n
أبو الفداء زين الدين قاسم بن قطلوبغا السودوني	زين الدين أبو العدل قاسم بن قطلوبغا السودوني (نسبة إلى معتق أبيه سودون الشيخوني) الجمالي الحنفي (المتوفى: 879هـ)	y
أبو الحسين محمد بن أحمد بن عبد الرحمن بن يحيى بن جميع الغساني الصيداوي (المتوفى: 402هـ)	محمد بن أحمد بن الحسين	n
أبو الفضل العراقي	عبد الرحيم بن الحسين العراقي أبو الفضل	y
أبو الفرج عبد الرحمن بن الجوزي الحنبلي	أبو الفرج عبد الرحمن بن علي بن الجوزي	y
أبو القاسم هبة الله بن سلامة بن نصر بن علي البغدادي المقري (المتوفى: 410هـ)	البغدادي	n
أبو بكر محمد بن إبراهيم بن علي بن عاصم بن زاذان الأصبهاني الخازن، المشهور بابن المقرئ (المتوفى : 381هـ)	أبو بكر محمد بن إبراهيم بن علي بن عاصم بن زاذان الأصبهاني الخازن، المشهور بابن المقرئ (المتوفى: 381هـ)	y
أبو بكر أحمد بن علي بن ثابت الخطيب البغدادي	أحمد بن علي أبو بكر الخطيب البغدادي	y
أبو الحسن علي بن عمر بن أحمد بن مهدي بن مسعود بن النعمان بن دينار البغدادي الدارقطني (المتوفى: 385هـ)	علي بن عمر أبو الحسن الدارقطني	y
أبو المظفر منصور بن محمد بن عبد الجبار السمعاني	السمعاني	y
أبو بكر بن أحمد بن محمد بن عمر الأسدي الشهبي الدمشقي، تقي الدين ابن قاضي شهبة (المتوفى: 851هـ)	أبو بكر بن أحمد بن محمد بن عمر بن قاضي شهبة	y
السيوطي	جلال الدين السيوطي	y
أبو بكر أحمد بن علي بن ثابت الخطيب البغدادي	الخطيب البغدادي	y
أبو الفرج عبد الرحمن بن علي الجوزي	جمال الدين أبو الفرج عبد الرحمن بن علي بن محمد الجوزي (المتوفى: 597هـ) (منسوب خطأ في المطبوع لابن قيم الجوزية)	y
أبو الحسين محمد بن أحمد بن عبد الرحمن بن يحيى بن جميع الغساني الصيداوي (المتوفى: 402هـ)	محمد بن أحمد بن جميع الصيداوي أبو الحسين	y
أبو إسحاق إبراهيم بن علي الشيرازي	أبو اسحاق إبراهيم بن علي الشيرازي (المتوفى: 476هـ)	y
أبو الحجاج مجاهد بن جبر التابعي المكي القرشي المخزومي (المتوفى: 104هـ)	مجاهد بن جبر	y
أبو القاسم عبد الله بن محمد بن عبد العزيز البغوي	عبد الله بن محمد بن عبد العزيز البغوي أبو القاسم	y
شمس الدين أبو الخير محمد بن عبد الرحمن بن محمد السخاوي (المتوفى: 902هـ)	شمس الدين أبو الخير محمد بن عبد الرحمن بن محمد بن أبي بكر بن عثمان بن محمد السخاوي (المتوفى: 902هـ)	y
أبو بكر بن أبي داود السجستاني عبد الله بن بن سليمان بن الأشعث	أبو بكر عبد الله بن سليمان بن الأشعث السجستاني	y
أحمد بن حجر العسقلاني	أحمد بن علي العسقلاني أبو الفضل	y
أبو الحسن علي بن إسماعيل بن سيده المرسي [ت: 458هـ]	علي بن إسماعيل بن سيده (المتوفى : 458هـ)	y
أبو الحسن علي بن محمد الماوردي الشافعي	الماوردي	y
أبو بكر بن أبي داود السجستاني عبد الله بن بن سليمان بن الأشعث	سليمان بن الأشعث أبو داود السجستاني	m
أبو الفرج عبد الرحمن بن علي الجوزي	أبي الفرج عبد الرحمن بن الجوزي	y
أبو الصفا صلاح الدين خليل بن عز الدين أيبك بن عبد الله الألبكي الصفدي	الصفدي	y
أبو بكر أحمد بن إبراهيم بن إسماعيل بن العباس بن مرداس الإسماعيلي الجرجاني (المتوفى: 371هـ)	أحمد بن إبراهيم بن إسماعيل الإسماعيلي أبو بكر	y
أبو العباس شمس الدين أحمد بن محمد بن إبراهيم بن أبي بكر ابن خلكان البرمكي الإربلي (المتوفى: 681هـ)	ابن خلكان	y
الشيخ محمد حسين الحائري	الشيخ محمد حسين الحاج	n
أبو الريحان محمد بن أحمد البيروني (المتوفى : 440هـ)	أبو الريحان محمد بن أحمد البيروني الخوارزمي (المتوفى: 440هـ)	y
أبو بكر أحمد بن علي بن ثابت الخطيب	أحمد بن علي بن ثابت الخطيب البغدادي	y
شهاب الدين عبد الرحمن بن إسماعيل بن إبراهيم المقدسي الدمشقي	عبد الرحمن بن إسماعيل بن إبراهيم	y
أبو بكر عبد الله بن محمد بن أبي الدنيا	أبو بكر عبد الله بن محمد بن عبيد ابن أبي الدنيا القرشي البغدادي	y
أبو المحاسن يوسف بن أحمد بن محمود اليغموري (المتوفى : 673هـ)	أبو المحاسن يوسف بن أحمد بن محمود اليغموري (المتوفى: 673هـ)	y
أحمد بن الحسين البيهقي أبو بكر	أحمد بن الحسين بن علي بن موسى الخسروجردي الخراساني، أبو بكر البيهقي (المتوفى : 458هـ)	y
أبو الفرج عبد الرحمن بن أبي الحسن الجوزي	ابن الجوزي	y
علي بن عمر أبو الحسن الدارقطني البغدادي	علي بن عمر بن أحمد الدارقطني	y
أبو القاسم حمزة بن يوسف بن إبراهيم السهمي القرشي الجرجاني (المتوفى: 427هـ)	حمزة بن يوسف أبو القاسم الجرجاني	m
أبو بكر أحمد بن علي بن ثابت الخطيب	أبو بكر أحمد بن علي بن ثابت الخطيب البغدادي (المتوفى: 463هـ)	y
أبو القاسم محمود بن عمر الزمخشري	جار الله الزمخشري	y
أبو الفرج عبد الرحمن بن علي الجوزي	عبد الرحمن بن علي بن محمد الجوزي	y
أبو الحسن على بن موسى بن سعيد المغربي (المتوفى: 685هـ)	أبو الحسن على بن موسى بن سعيد المغربي الأندلسي (المتوفى: 685هـ)	y
أبو الحسن علي بن إسماعيل بن سيده المرسي (المتوفى: 458هـ)	علي بن إسماعيل بن سيده (المتوفى: 458هـ)	y
الحسن بن عبد الله بن سعيد العسكري أبو أحمد	العسكري	y
جمال الدين أبو الفرج عبد الرحمن بن علي بن محمد الجوزي (المتوفى: 597هـ) (منسوب خطأ في المطبوع لابن قيم الجوزية)	عبد الرحمن بن علي بن الجوزي	y
أبي منصور عبد الملك بن محمد بن إسماعيل الثعالبي	عبد الملك بن محمد بن إسماعيل أبو منصور الثعالبي (المتوفى: 429 هـ)	y
السبكي	تقي الدين السبكي	y
أبو الحسن ظهير الدين علي بن زيد البيهقي ، الشهير بابن فندمه (المتوفى : 565هـ)	أبو الحسن ظهير الدين علي بن زيد بن محمد بن الحسين البيهقي، الشهير بابن فندمه (المتوفى: 565هـ)	y
أبو بكر بن أبي عاصم وهو أحمد بن عمرو بن الضحاك بن مخلد الشيباني (المتوفى: 287هـ)	الضحاك	y
أبو الخير محمد بن أحمد بن محمد بن عمر بن القاسم بن عبد الله بن علي بن إسحاق بن سندار الأصبهاني، المقدر، المهندس، المؤذن، الصوفي، شهر بالباغبان. (المتوفى: 559هـ)	الأصبهاني	n
